{
  "$schema": "https://json-schema.org/draft/2020-12/schema",
  "schema": "graphforge-progressive-host-run-plan-schema/1",
  "type": "object",
  "additionalProperties": false,
  "required": ["schema", "rung", "execution", "identities", "limits", "outputs", "claim"],
  "properties": {
    "schema": {"const": "graphforge-progressive-host-run-plan/1"},
    "rung": {"enum": ["S18", "S19", "S20", "S22", "S24", "S25", "S26"]},
    "execution": {"const": "native_linux_benchexec_host"},
    "identities": {
      "type": "object",
      "additionalProperties": false,
      "required": [
        "commit",
        "host_profile_id",
        "host_profile_sha256",
        "profile_id",
        "profile_sha256",
        "generator",
        "generator_executable_sha256",
        "gf_sha256",
        "certify_sha256",
        "benchexec_python_sha256",
        "benchexec_version"
      ],
      "properties": {
        "commit": {"type": "string", "pattern": "^[0-9a-f]{40}$"},
        "producer_sha256": {"$ref": "#/$defs/digest"},
        "host_profile_id": {"const": "local-linux-cgroups-v2"},
        "host_profile_sha256": {"$ref": "#/$defs/digest"},
        "profile_id": {
          "enum": [
            "graph500-s18-local",
            "graph500-s19-local",
            "graph500-s20-provider",
            "graph500-s22-provider",
            "graph500-s24-provider",
            "graph500-s25-provider",
            "graph500-s26-provider"
          ]
        },
        "profile_sha256": {"$ref": "#/$defs/digest"},
        "generator": {"type": "string", "pattern": "^sha256:[0-9a-f]{64}$"},
        "generator_executable_sha256": {"$ref": "#/$defs/digest"},
        "gf_sha256": {"$ref": "#/$defs/digest"},
        "certify_sha256": {"$ref": "#/$defs/digest"},
        "benchexec_python_sha256": {"$ref": "#/$defs/digest"},
        "benchexec_version": {"type": "string", "pattern": "^[0-9]+(\\.[0-9]+)+$"},
        "admitted_projection_sha256": {"$ref": "#/$defs/digest"}
      }
    },
    "work_root_capacity": {
      "type": "object", "additionalProperties": false,
      "required": ["free_bytes", "reserved_headroom_bytes"],
      "properties": {
        "free_bytes": {"type": "integer", "minimum": 1},
        "reserved_headroom_bytes": {"type": "integer", "minimum": 0}
      }
    },
    "limits": {
      "type": "object",
      "additionalProperties": false,
      "required": ["wall_seconds", "memory_bytes", "cores"],
      "properties": {
        "wall_seconds": {"type": ["integer", "null"], "minimum": 1, "maximum": 14400},
        "memory_bytes": {"const": 4294967296},
        "cores": {"const": 16}
      }
    },
    "wall_policy": {
      "type": "object",
      "additionalProperties": false,
      "required": ["maximum_wall_seconds", "reference_wall_seconds", "margin"],
      "properties": {
        "maximum_wall_seconds": {"enum": [14400, null]},
        "reference_wall_seconds": {"oneOf": [{"type": "null"}, {"type": "integer", "minimum": 1}]},
        "margin": {"type": ["number", "null"], "minimum": 0}
      }
    },
    "launch_host": {
      "type": "object",
      "additionalProperties": false,
      "required": ["window_seconds", "waited_seconds", "mean_busy_cores", "peak_busy_cores"],
      "properties": {
        "window_seconds": {"type": "integer", "minimum": 1},
        "waited_seconds": {"type": "integer", "minimum": 0},
        "mean_busy_cores": {"type": "number", "minimum": 0},
        "peak_busy_cores": {"type": "number", "minimum": 0}
      }
    },
    "outputs": {
      "type": "array",
      "minItems": 5,
      "maxItems": 5,
      "uniqueItems": true,
      "items": {
        "type": "string",
        "pattern": "^s(18|19|20|22|24|25|26)-(plan|benchexec|graphforge|rung|result)\\.json$"
      }
    },
    "claim": {"const": "engineering_evidence_only"}
  },
  "allOf": [
    {
      "if": {"properties": {"rung": {"enum": ["S24", "S25", "S26"]}}, "required": ["rung"]},
      "then": {
        "properties": {
          "limits": {"properties": {"wall_seconds": {"const": null}}},
          "wall_policy": {"const": {"maximum_wall_seconds": null, "reference_wall_seconds": null, "margin": null}}
        }
      },
      "else": {
        "properties": {
          "limits": {"properties": {"wall_seconds": {"type": "integer"}}},
          "wall_policy": {"properties": {"maximum_wall_seconds": {"const": 14400}, "margin": {"type": "number"}}}
        }
      }
    },
    {
      "if": {"properties": {"rung": {"enum": ["S20", "S22", "S24", "S25", "S26"]}}, "required": ["rung"]},
      "then": {
        "properties": {
          "identities": {"required": ["admitted_projection_sha256"]}
        }
      }
    },
    {
      "if": {"properties": {"rung": {"const": "S18"}}, "required": ["rung"]},
      "then": {
        "properties": {
          "outputs": {
            "const": [
              "s18-plan.json",
              "s18-benchexec.json",
              "s18-graphforge.json",
              "s18-rung.json",
              "s18-result.json"
            ]
          }
        }
      }
    },
    {
      "if": {"properties": {"rung": {"const": "S19"}}, "required": ["rung"]},
      "then": {
        "properties": {
          "outputs": {
            "const": [
              "s19-plan.json",
              "s19-benchexec.json",
              "s19-graphforge.json",
              "s19-rung.json",
              "s19-result.json"
            ]
          }
        }
      }
    },
    {
      "if": {"properties": {"rung": {"const": "S20"}}, "required": ["rung"]},
      "then": {
        "properties": {
          "outputs": {
            "const": [
              "s20-plan.json",
              "s20-benchexec.json",
              "s20-graphforge.json",
              "s20-rung.json",
              "s20-result.json"
            ]
          }
        }
      }
    },
    {
      "if": {"properties": {"rung": {"const": "S22"}}, "required": ["rung"]},
      "then": {
        "properties": {
          "outputs": {
            "const": [
              "s22-plan.json",
              "s22-benchexec.json",
              "s22-graphforge.json",
              "s22-rung.json",
              "s22-result.json"
            ]
          }
        }
      }
    },
    {
      "if": {"properties": {"rung": {"const": "S24"}}, "required": ["rung"]},
      "then": {
        "properties": {
          "outputs": {
            "const": [
              "s24-plan.json",
              "s24-benchexec.json",
              "s24-graphforge.json",
              "s24-rung.json",
              "s24-result.json"
            ]
          }
        }
      }
    },
    {
      "if": {"properties": {"rung": {"const": "S25"}}, "required": ["rung"]},
      "then": {
        "properties": {
          "outputs": {
            "const": [
              "s25-plan.json",
              "s25-benchexec.json",
              "s25-graphforge.json",
              "s25-rung.json",
              "s25-result.json"
            ]
          }
        }
      }
    },
    {
      "if": {"properties": {"rung": {"const": "S26"}}, "required": ["rung"]},
      "then": {
        "properties": {
          "outputs": {
            "const": [
              "s26-plan.json",
              "s26-benchexec.json",
              "s26-graphforge.json",
              "s26-rung.json",
              "s26-result.json"
            ]
          }
        }
      }
    }
  ],
  "$defs": {"digest": {"type": "string", "pattern": "^[0-9a-f]{64}$"}}
}
